{
  "schema_name": "case-manifest",
  "schema_version": "1.0.0",
  "case_id": "case-aaaaaaaaaaaaaaaaaaaaaaaa",
  "created_at": "2026-07-27T12:00:00Z",
  "updated_at": "2026-07-27T12:05:00Z",
  "runtime": "winpe",
  "current_state": "DIAGNOSING",
  "target_ids": ["target-disk-nvme0n1"],
  "privacy_class": "standard",
  "technician_storage_reference": "cases/case-aaaaaaaaaaaaaaaaaaaaaaaa"
}
